{
  "name": "breadcrumb",
  "description": "Navigasi hierarki jalur halaman terakses",
  "category": "navigation",
  "frameworks": ["react"],
  "version": "0.1.0",
  "files": { "react": ["breadcrumb.tsx"] },
  "dependencies": [],
  "registryDependencies": [],
  "tailwind": { "cssVars": ["--qlx-color-muted-foreground"] },
  "docs": "docs/03-components/breadcrumb",
  "compatibility": { "tailwind": ">=3.0.0", "react": ">=18.0.0" }
}
