{
  "name": "card",
  "description": "Container untuk visual grouping konten dengan padding dan radius konsisten",
  "category": "layout",
  "frameworks": ["react"],
  "version": "0.1.0",
  "files": { "react": ["card.tsx"] },
  "dependencies": [],
  "registryDependencies": [],
  "tailwind": {
    "cssVars": [
      "--qlx-color-background",
      "--qlx-color-foreground",
      "--qlx-color-border",
      "--qlx-radius-md"
    ]
  },
  "docs": "docs/03-components/card",
  "compatibility": {
    "tailwind": ">=3.0.0",
    "react": ">=18.0.0"
  }
}
