{
  "name": "accordion",
  "description": "Panel terlipat vertikal untuk menampilkan/menyembunyikan konten",
  "category": "layout",
  "frameworks": ["react"],
  "version": "0.1.0",
  "files": { "react": ["accordion.tsx"] },
  "dependencies": [],
  "registryDependencies": [],
  "tailwind": { "cssVars": ["--qlx-color-border", "--qlx-color-muted-foreground"] },
  "docs": "docs/03-components/accordion",
  "compatibility": { "tailwind": ">=3.0.0", "react": ">=18.0.0" }
}
