{
  "name": "badge",
  "description": "Label badge kecil untuk status, tag, atau jumlah",
  "category": "data-display",
  "frameworks": ["react"],
  "version": "0.1.0",
  "files": { "react": ["badge.tsx"] },
  "dependencies": [],
  "registryDependencies": [],
  "tailwind": { "cssVars": ["--qlx-color-primary", "--qlx-color-secondary", "--qlx-color-destructive"] },
  "docs": "docs/03-components/badge",
  "compatibility": { "tailwind": ">=3.0.0", "react": ">=18.0.0" }
}
